{
  "schema_version": "proofkey-transition-v1",
  "visibility": "evaluator_only",
  "transition_id": "transition-1",
  "episode_id": "episode-1",
  "from_input_id": "input-0",
  "to_input_id": "input-1",
  "trigger": "new_evidence",
  "conditions": [
    {
      "type": "source_matches",
      "source": {
        "case_id": "demo-1",
        "revision": 0,
        "snapshot_hash": "5e0afab1a4e4359af9ad37c6a4043890f99c9522492a4ed43eebd2bc26d51727"
      }
    }
  ],
  "description": "Evaluator edge; future input is not included in input-0.",
  "provenance": {
    "source_kind": "local_fixture",
    "source_id": "fixture-demo-1",
    "collected_at": "2026-10-10T10:00:00Z"
  }
}
